<?xml version="1.0" encoding="UTF-8"?>
<?xml-stylesheet href="lab3.xsl" type="text/xsl"?>
<!-- <!DOCTYPE Service_centre SYSTEM "sevice.dtd"> -->
<Service_centre xmlns:xsi="http://www.w3.org/2001/XMLSchema-instance" xsi:noNamespaceSchemaLocation="lab3.xsd">
  <Services>
    <SERVICE_ID>100</SERVICE_ID>
    <SERVICE_TYPE>INTERIM SERVICE</SERVICE_TYPE>
    <SERVICE_CHARGE>450</SERVICE_CHARGE>
    <VEHICLE_TYPE>CAR</VEHICLE_TYPE>
  </Services>

  <Services>
    <SERVICE_ID>102</SERVICE_ID>
    <SERVICE_TYPE>FULL SERVICE</SERVICE_TYPE>
    <SERVICE_CHARGE>5450</SERVICE_CHARGE>
    <VEHICLE_TYPE>TRUCK</VEHICLE_TYPE>
  </Services>

  <Services>
    <SERVICE_ID>104</SERVICE_ID>
    <SERVICE_TYPE>MAJOR SERVICE</SERVICE_TYPE>
    <SERVICE_CHARGE>4650</SERVICE_CHARGE>
    <VEHICLE_TYPE>BIKE</VEHICLE_TYPE>
  </Services>

  <Services>
    <SERVICE_ID>101</SERVICE_ID>
    <SERVICE_TYPE>FULL SERVICE</SERVICE_TYPE>
    <SERVICE_CHARGE>6550</SERVICE_CHARGE>
    <VEHICLE_TYPE>TRUCK</VEHICLE_TYPE>
  </Services>

  <Services>
    <SERVICE_ID>103</SERVICE_ID>
    <SERVICE_TYPE>INTERIM SERVICE</SERVICE_TYPE>
    <SERVICE_CHARGE>850</SERVICE_CHARGE>
    <VEHICLE_TYPE>BIKE</VEHICLE_TYPE>
  </Services>


</Service_centre>